

Release 02

1.
sqlite> .mode column
sqlite> .headers on
sqlite> .width 3 15 10 7 15
sqlite> .tables
country    mountains
sqlite> .mode column

sqlite> SELECT * FROM mountains;
id   name             elevation   climbed  country_id     
---  ---------------  ----------  -------  ---------------
1    Aso-san          5223        true     2              
2    Blanca Peak      14344       false    1              
3    Fuji-san         12389       true     2              
4    Gassan           6509        true     2              
5    Longs Peak       14259       true     1              
6    Grays Peak       14278       false    1              
7    Kita-dake        10476       false    2              
8    Mount Evans      14265       true     1              
9    Pikes Peak       14114       true     1              
10   Warusawa-san     10305       false    2     


2. 
sqlite> UPDATE mountains SET climbed = "false" WHERE name = "Mount Evans";
sqlite> select * from mountains;

id   name             elevation   climbed  country_id     
---  ---------------  ----------  -------  ---------------
1    Aso-san          5223        true     2              
2    Blanca Peak      14344       false    1              
3    Fuji-san         12389       true     2              
4    Gassan           6509        true     2              
5    Longs Peak       14259       true     1              
6    Grays Peak       14278       false    1              
7    Kita-dake        10476       false    2              
8    Mount Evans      14265       false    1              
9    Pikes Peak       14114       true     1              
10   Warusawa-san     10305       false    2     


3.
sqlite> SELECT * FROM mountains JOIN country ON mountains.country_id = country.country_id;

id   name             elevation   climbed  country_id       country_id  countries 
---  ---------------  ----------  -------  ---------------  ----------  ----------
1    Aso-san          5223        true     2                2           Japan     
2    Blanca Peak      14344       false    1                1           United Sta
3    Fuji-san         12389       true     2                2           Japan     
4    Gassan           6509        true     2                2           Japan     
5    Longs Peak       14259       true     1                1           United Sta
6    Grays Peak       14278       false    1                1           United Sta
7    Kita-dake        10476       false    2                2           Japan     
8    Mount Evans      14265       false    1                1           United Sta
9    Pikes Peak       14114       true     1                1           United Sta
10   Warusawa-san     10305       false    2                2           Japan   

or a cleaner display:

sqlite> SELECT mountains.id, mountains.name, mountains.elevation, mountains.climbed, country.countries FROM mountains JOIN country ON mountains.country_id = country.country_id;
id   name             elevation   climbed  countries      
---  ---------------  ----------  -------  ---------------
1    Aso-san          5223        true     Japan          
2    Blanca Peak      14344       false    United States  
3    Fuji-san         12389       true     Japan          
4    Gassan           6509        true     Japan          
5    Longs Peak       14259       true     United States  
6    Grays Peak       14278       false    United States  
7    Kita-dake        10476       false    Japan          
8    Mount Evans      14265       false    United States  
9    Pikes Peak       14114       true     United States  
10   Warusawa-san     10305       false    Japan  




4.
sqlite> SELECT mountains.id, mountains.name, country.countries FROM mountains JOIN country ON mountains.country_id = country.country_id;

id   name             countries 
---  ---------------  ----------
1    Aso-san          Japan     
2    Blanca Peak      United Sta
3    Fuji-san         Japan     
4    Gassan           Japan     
5    Longs Peak       United Sta
6    Grays Peak       United Sta
7    Kita-dake        Japan     
8    Mount Evans      United Sta
9    Pikes Peak       United Sta
10   Warusawa-san     Japan 

5.
sqlite> DELETE FROM mountains WHERE name = "Grays Peak";

id   name             elevation   climbed  countries      
---  ---------------  ----------  -------  ---------------
1    Aso-san          5223        true     Japan          
2    Blanca Peak      14344       false    United States  
3    Fuji-san         12389       true     Japan          
4    Gassan           6509        true     Japan          
5    Longs Peak       14259       true     United States  
7    Kita-dake        10476       false    Japan          
8    Mount Evans      14265       false    United States  
9    Pikes Peak       14114       true     United States  
10   Warusawa-san     10305       false    Japan  
